Titre,Prix
Birdsong: A Story in Pictures,Â54.64
The Bear and the Piano,Â36.89
The Secret of Dreadwillow Carse,Â56.13
The White Cat and the Monk: A Retelling of the Poem âPangur BÃ¡nâ,Â58.08
Little Red,Â13.47
Walt Disney's Alice in Wonderland,Â12.96
Twenty Yawns,Â22.08
Rain Fish,Â23.57
Once Was a Time,Â18.28
Luis Paints the World,Â53.95
Nap-a-Roo,Â25.08
The Whale,Â35.96
"Shrunken Treasures: Literary Classics, Short, Sweet, and Silly",Â52.87
Raymie Nightingale,Â34.41
Playing from the Heart,Â32.38
Maybe Something Beautiful: How Art Transformed a Neighborhood,Â22.54
The Wild Robot,Â56.07
The Thing About Jellyfish,Â48.77
The Lonely Ones,Â43.59
The Day the Crayons Came Home (Crayons),Â26.33
The Cat in the Hat (Beginner Books B-1),Â16.26
Red: The True Story of Red Riding Hood,Â28.54
Horrible Bear!,Â37.52
Green Eggs and Ham (Beginner Books B-16),Â10.79
Counting Thyme,Â10.62
Are We There Yet?,Â10.66
Diary of a Minecraft Zombie Book 1: A Scare of a Dare (An Unofficial Minecraft Book),Â52.88
Matilda,Â28.34
Charlie and the Chocolate Factory (Charlie Bucket #1),Â22.85
